{"actions_by_effect_class":{"external_communication":0,"irreversible":1,"physical":0,"read":0,"spend":0,"unspecified":0,"write":0},"drift":{"models":["security-view-fixture-model"],"tools":["<script>alert(1)"]},"enforcement_point_evidence":{"approvals_by_recorder":{"enforcement_point":0,"independent_system":0,"self_report":0},"denied_or_blocked":{"approval_rejected":0,"authz_denied":1,"policy_denied":0,"refused":0}},"standards_citations":[{"clause":"AML.T0101","control":"INT-01","framework":"mitre-atlas","verified":false},{"clause":"AML.T0108","control":"INT-01","framework":"mitre-atlas","verified":false},{"clause":"ASI08","control":"INT-01","framework":"owasp-asi-2026","verified":false},{"clause":"ASI10","control":"INT-01","framework":"owasp-asi-2026","verified":false},{"clause":"AML.T0101","control":"OVS-03","framework":"mitre-atlas","verified":false},{"clause":"ASI09","control":"OVS-03","framework":"owasp-asi-2026","verified":false},{"clause":"Hook_SubagentStart+Hook_SubagentStop","control":"REC-01","framework":"owasp-acs","verified":false},{"clause":"ASI08","control":"REC-01","framework":"owasp-asi-2026","verified":false},{"clause":"AML.T0073","control":"REC-04","framework":"mitre-atlas","verified":false},{"clause":"AML.T0074","control":"REC-04","framework":"mitre-atlas","verified":false},{"clause":"ASI01","control":"REC-04","framework":"owasp-asi-2026","verified":false},{"clause":"ASI08","control":"REC-04","framework":"owasp-asi-2026","verified":false},{"clause":"AML.T0051","control":"ROB-02","framework":"mitre-atlas","verified":false},{"clause":"AML.T0051.001","control":"ROB-02","framework":"mitre-atlas","verified":false},{"clause":"AML.T0080","control":"ROB-02","framework":"mitre-atlas","verified":false},{"clause":"AML.T0080.000","control":"ROB-02","framework":"mitre-atlas","verified":false},{"clause":"ASI05","control":"ROB-02","framework":"owasp-asi-2026","verified":false},{"clause":"ASI06","control":"ROB-02","framework":"owasp-asi-2026","verified":false}],"tool_access":[{"name":"<script>alert(1)","protocol":"","server":""}]}